{
  "evidence_id": "evidence:m87:calibrated-release-2019-D01-01",
  "evidence_type": "dataset",
  "source_uri": "https://github.com/eventhorizontelescope/2019-D01-01/tree/27ae76aacb9067a83388395c3826012b97aac371",
  "source_hash": "9134b5f261bd6936d9e25547eca722be89b325b587fe22d06ba980b0de31a896",
  "collected_at": "2026-07-25T14:10:17Z",
  "instrument_ref": "instrument:eht:network",
  "transformation_refs": [],
  "uncertainty": {
    "description": "SHA-256 inventory was computed by GitHub Actions from the official EHT Git repository pinned to commit 27ae76aacb9067a83388395c3826012b97aac371. Byte-for-byte equivalence with the CyVerse DOI endpoint has not yet been independently checked.",
    "value": null,
    "unit": null
  }
}
